issue_title,difficulty,tags
"Update contributing guidelines.",easy,"documentation"
"Fix broken link in email footer.",easy,"documentation|bug"
"Add missing required field indicator.",easy,"ui|frontend"
"Update outdated dependency in lock file.",easy,"backend|documentation"
"Fix inconsistent error icon color.",easy,"ui|frontend"
"Add missing success message after action.",easy,"ux|frontend"
"Update readme with installation steps.",easy,"documentation"
"Fix typo in API response message.",easy,"api|bug"
"Add missing close button to modal.",easy,"ui|frontend"
"Update license file with correct year.",easy,"documentation|legal"
"Fix inconsistent spacing in card layouts.",easy,"ui|frontend"
"Add missing confirmation for logout.",easy,"ux|frontend"
"Update environment variable documentation.",easy,"documentation|devops"
"Fix typo in configuration comments.",easy,"documentation|backend"
"Add missing label for form field.",easy,"ui|frontend"
"Update security documentation.",easy,"documentation|security"
"Fix broken mailto link in contact page.",easy,"frontend|bug"
"Add missing skip link for accessibility.",easy,"frontend|ux"
"Update deployment documentation.",easy,"documentation|devops"
"Fix inconsistent font weight in headings.",easy,"ui|frontend"
"Add missing breadcrumb separator.",easy,"ui|frontend"
"Update troubleshooting guide.",easy,"documentation"
"Fix typo in tooltip text.",easy,"ui|frontend"
"Add missing empty state message.",easy,"ux|frontend"
"Update code comments for clarity.",easy,"documentation|backend"
"Fix broken anchor link on page.",easy,"frontend|bug"
"Add missing input validation message.",easy,"ux|frontend"
"Update API rate limit documentation.",easy,"documentation|api"
"Fix inconsistent table border colors.",easy,"ui|frontend"
"Add missing focus outline for buttons.",easy,"frontend|ux"
"Update webhook documentation examples.",easy,"documentation|api"
"Fix typo in notification message.",easy,"frontend|bug"
"Add missing pagination label.",easy,"ui|frontend"
"Update database schema documentation.",easy,"documentation|database"
"Fix inconsistent dropdown arrow styles.",easy,"ui|frontend"
"Add missing status indicator colors.",easy,"ui|frontend"
"Update error code documentation.",easy,"documentation|api"
"Fix broken social media links.",easy,"frontend|bug"
"Add missing character counter for input.",easy,"ui|frontend"
"Update migration guide for new version.",easy,"documentation"
"Fix wrong color on active menu item.",easy,"ui|frontend"
"Add missing tooltip for icon button.",easy,"ux|frontend"
"Update FAQ with common questions.",easy,"documentation"
"Fix misaligned avatar in header.",easy,"ui|frontend"
"Add missing loading state for button.",easy,"ui|frontend"
"Update keyboard shortcut documentation.",easy,"documentation|ux"
"Fix extra whitespace in footer text.",easy,"ui|frontend"
"Add missing error icon to form field.",easy,"ui|frontend"
"Update README badges with latest versions.",easy,"documentation"
"Fix truncated text in narrow containers.",easy,"ui|frontend"
"Add missing hover effect on cards.",easy,"ui|frontend"
"Update CODEOWNERS file with new team.",easy,"documentation|devops"
"Fix inconsistent border radius on buttons.",easy,"ui|frontend"
"Add missing lang attribute to HTML.",easy,"frontend|ux"
"Update pull request template.",easy,"documentation|devops"
"Fix wrong text color in dark mode.",easy,"ui|frontend"
"Add missing meta description tag.",easy,"frontend|seo"
"Update issue templates for bugs.",easy,"documentation|devops"
"Fix blurry logo on retina displays.",easy,"ui|frontend"
"Add missing autocomplete attribute.",easy,"frontend|ux"
"Update code style guide documentation.",easy,"documentation|backend"
